SMILES,CID,creator,rationale,fragments
CC(=O)C=CC1(Cc2ccccc2)COC(Cn2cc3c(n2)CC(NC(=N)N)C3c2nc(Cc3ccccc3)co2)=N1,ABH-HOE-8c8-1,"Abhishek Jalan and Bruce Lichtenstein, Hoecker Group (Uni-Bayreuth) and University of Portsmouth School of Biological Sciences","We had previously submitted a peptide ligand with sequence GFRGFS (submission # ABH-HOE-1cb). We converted it to a peptidomimetic molecule with a Michael acceptor for covalent bonding to Cys145 and docked it onto 6y2e PDB using rosetta ligand docking. The approximate ligand docking protocol is as follows, 
1. First we used SiteHound to identify posssible ligand binding sites in 6y2e using a Methyl probe. Three binding sites were found but only the active site showed the highest score qualifying for the subsequent docking run. 
2. The ligand was placed close to 6y2e at the XYZ coordinates obtained for high scoring solution from SiteHound. 10,000 docking poses were generated by restricting the ligand to a box of 10 Å radius and perturbing (rotation + translation) the ligand 5 Å. Rosetta calculated the interface_delta score which is approximate measure of the interaction between the ligand and the protein. Top 10 solution sorted using interface_delta score were manually inspected in pymol. All 10 solutions docked the ligand in the active site.
Key Features of the docked pose are:
- The peptidomimetic molecule contains two phenylalanines and one arginine. 
- The Michael acceptor is placed close to C145 for covalent bond formation
- The N-term Phe occupies hydrophobic pocket formed by residues H41, M49, F140, H163
- The C-term Phe occupies hydrophobic pocket formed by residues M165, L167, F185 and V186
- Arg forms a salt-bridge to E166 and another polar contact to the backbone carbonyls of residues L167 and P168. 

The ligand buries a total surface area of ~ 500 Å^2. 

Please see discussions for some pictures of the docked structure and docking evaluation.",x0072
CC(=O)C=CC1(Cc2ccccc2)COC(Cn2cc3c(n2)CC(NC(=N)N)C3c2nc(Cc3ccccc3)co2)=N1,ABH-UNI-d4f-1,"Abhishek Jalan and Bruce Lichtenstein, University of Bayreuth and University of Portsmouth","We had previously submitted a peptide ligand with sequence GFRGFS (submission # ABH-HOE-1cb). We converted it to a peptidomimetic molecule with a Michael acceptor for covalent bonding to Cys145 and docked it onto 6y2e PDB using rosetta ligand docking. The approximate ligand docking protocol is as follows, 
1. First we used SiteHound to identify posssible ligand binding sites in 6y2e using a Methyl probe. Three binding sites were found but only the active site showed the highest score qualifying for the subsequent docking run. 
2. The ligand was placed close to 6y2e at the XYZ coordinates obtained for high scoring solution from SiteHound. 10,000 docking poses were generated by restricting the ligand to a box of 10 Å radius and perturbing (rotation + translation) the ligand 5 Å. Rosetta calculated the interface_delta score which is approximate measure of the interaction between the ligand and the protein. Top 10 solution sorted using interface_delta score were manually inspected in pymol. All 10 solutions docked the ligand in the active site.
Key Features of the docked pose are:
- The peptidomimetic molecule contains two phenylalanines and one arginine. 
- The Michael acceptor is placed close to C145 for covalent bond formation
- The N-term Phe occupies hydrophobic pocket formed by residues H41, M49, F140, H163
- The C-term Phe occupies hydrophobic pocket formed by residues M165, L167, F185 and V186
- Arg forms a salt-bridge to E166 and another polar contact to the backbone carbonyls of residues L167 and P168. 

The ligand buries a total surface area of ~ 500 Å^2. 

Please see the discussion form for some pictures of the docking pose and evaluation of the docking results.",x0072
CC(=O)N1CCN(CC(=O)Nc2cccc(S(N)(=O)=O)c2)CC1,JAN-GHE-1d9-7,"Jan Hullaert, Ghent University",Combinations of preserved sulfonamide and acetylpiperazine parts.,"x0161,x0195,x0692,x1386"
CC(=O)N1CCN(CC(=O)Nc2cccc(S(N)(=O)=O)c2)CC1,LON-WEI-b8d-4,"London Lab, Weizmann Institute of Science","Molecules made by Ugi reaction, designed by members of London Lab",x0072
CC(=O)NCCc1c[nH]c2c(CCNS(C)(=O)=O)cc(Cl)cc12,BEN-DND-362-8,"Benjamin Perry, DNDi","By eye fragment merging approach; 3 discreet clusters of non-covalent binders identified in the active site. Each cluster had >n=2 examples of closeley related hits, giving confidence in the hit. Various designs made to merge the different fragments whilst retaining shape, binding location  and orientation","x0072,x0104,x0107,x0161,x0434,x0689,x0691"
CC(=O)NCCc1c[nH]c2c(CCNS(C)(=O)=O)cc(Cl)cc12,ROB-UNI-b2e-4,"Robert Quinlan, University of Oxford","From fragalysis, observation of overlap of functionalities from the fragment hits.","x0072,x0104,x0305,x0748,x1249"
CC(=O)NCCc1c[nH]c2c(CCNS(C)(=O)=O)cc(F)cc12,SAM-UNK-903-2,Sam Walpole,"These molecules were produced via the joining of  fragments: x0104-x0387 and x104-x0072 at the 7-position of the indole ring of x0104. This was chosen as the indole of x0104 sits inside a hydrophobic pocket of the protease, that seems to be targeted by many of the fragments, and therefore may be key to binding. x0387/x0072 were chosen as second fragments as they occupy a nearby subsite and easily join to x104 with little strain.

These fragments were also tested with molecular docking and show docking poses similar to expected from their base fragments. The supplied PDB was generated simply by superposition of coordinates (x0104 and x0387), however docking results are available on request","x0072,x0104,x0387"
CC(=O)NCCc1c[nH]c2c(CCNS(C)(=O)=O)cc(F)cc12,TAM-UNI-c14-15,"Tamas Szommer, University of Oxford, TDI",The X-Ray hits were re-docked using multiple protein conformations. A fragment merging strategy was applied for only those docking hits which were found overlapping with the original fragments. The designed molecules were re-docked in the multiple protein conformation model to compare the docking poses with the X-ray structures. The best designed hits were selected for submission.,"x0072,x0104,x0195,x0434,x0678,x0946,x1093"
CC(=O)NCCc1c[nH]c2c(CCNS(C)(=O)=O)cc(F)cc12,SIM-DE -265-1,"Simon Wheeler, De Montfort University",By eye,"x0072,x0104"
CC(=O)NCCc1c[nH]c2c(CCNS(C)(=O)=O)cc(F)cc12,ELE-IMP-dfb-1,"Elena De Vita, Imperial College",Merging by eye of non-covalent fragments evolved with rational design to reduce flexibility.,"x0072,x0104,x0161"
CC(=O)NCCc1c[nH]c2c(CCNS(C)(=O)=O)cc(F)cc12,PET-SGC-f81-1,"PETER BROWN, SGC, Univ Toronto",Combo 0072 and 0104,"x0072,x0104"
CC(=O)NCCc1c[nH]c2c(CCNS(C)(=O)=O)cccc12,CAL-AMP-9ed-1,"Callum MacGregor, Amphista Therapuetics",Overlay of the crystal structure for 0072 and 0104 suggests a reasonable overlay to give a compound such as the one shown.,"x0072,x0104"
CC(=O)NCCc1c[nH]c2c(CCNS(C)(=O)=O)cccc12,DUN-NEW-f8c-10,"Duncan Miller, Newcastle University","Merging of x0072 with x1458 to combine the covalent warhead of x1458 with the sulfonamide fragment x1458 (Designs arrived at by overlay of crystal structures in Biovia Discovery Viewer, and identifying common vectors for fragment growth/merging by eye, with synthetic accessibility taken into account)","x0072,x1458"
CC(=O)NCCc1c[nH]c2c(CCNS(C)(=O)=O)cccc12,ELE-IMP-dfb-2,"Elena De Vita, Imperial College",Merging by eye of non-covalent fragments evolved with rational design to reduce flexibility.,"x0072,x0104,x0161"
CC(=O)NCCc1c[nH]c2c(CN3CCN(C(=O)CCl)CC3)cc(F)cc12,DAR-DIA-fb2-11,"Daren Fearon, Diamond Light Source Ltd",Merging of x0830 with x0305/x0104 and x0195 to target S1 pocket in addition to Cys145.,"x0104,x0195,x0305,x0830"
CC(=O)NCCc1c[nH]c2c(CN3CCN(C(=O)CCl)CC3)cc(F)cc12,STU-CHA-bc0-1,"Stuart Ward, Charles River Laboratories",Combination of covalent fragment x0692 with non-covalent x0104. Docking into crystal structure scores highly with carbonyl of pendant amide making interactions with Gln 182 (C=O-N 2.2A) and Thr190 (C=O-N 2.7A). Additional amide interaction of NH to carbonyl of Gly166 (NH-O 1.9A),"x0104,x0692"
CC(=O)NCCc1c[nH]c2c(CN3CCN(C(=O)CCl)CC3)cc(F)cc12,NAU-LAT-f72-1,"Nauris Narvaiss, Latvian Institute of Organic Synthesis","Compounds designed by eye, attempting to combine both covalent and non-covalent fragments. Some scaffolds of fragments were changed to ensure the appropriate geometry for combining the fragments. The idea behind nitrile - besides attemping to create a less toxic warhead, several covalent fragments show the adjacent amide oxygen interaction with Gly143. Almost all other other warheads would shift the oxygen relative to Gly143.","x0072,x0104,x0397,x0692,x1308,x1336"
CC(=O)NCCc1c[nH]c2c(CN3CCN(C(C)=O)CC3)cc(C#N)cc12,JOH-MSK-d60-1,"John Chodera, MSKCC",x0104 +  x0692/x0830,"x0104,x0692,x0830"
CC(=O)NCCc1c[nH]c2c(CN3CCN(C(C)=O)CC3)cc(C#N)cc12,PAT-UNK-b2d-5,Patrick Killoran,"combining fragments X0104 and X0692 by eye, trying to poke a hole","x0104,x0692"
CC(=O)NCCc1c[nH]c2ccc(C#N)cc12,DUN-NEW-f8c-12,"Duncan Miller, Newcastle University","Merging of x0072 with x1458 to combine the covalent warhead of x1458 with the sulfonamide fragment x1458 (Designs arrived at by overlay of crystal structures in Biovia Discovery Viewer, and identifying common vectors for fragment growth/merging by eye, with synthetic accessibility taken into account)","x0072,x1458"
CC(=O)NCCc1c[nH]c2ccc(C#N)cc12,MAT-GIT-dea-1,"Matthias Bauer, githubsubmission","Hi, here is a quick idea for growing the fluoroindole fragment (x010) via merging with other fragments and aiming to harness a Met-chloro halogen bond. Best wishes, Matthias

Cl added to interact with Met 165","x0104,x0434,x0678"
CC(=O)NCCc1c[nH]c2ccc(C#N)cc12,JOH-MEM-4bb-1,"John Chodera, Memorial Sloan Kettering Cancer Center",Substitutes x0104 -F substituent with -CN due to visual inspection of overlapping nitrile spatial orientation in x0305 and x1249 (suggested by Frank von Delft),x0104
CC(C(=O)O)c1ccc2c(c1)[nH]c1ccc(Cl)cc12,GER-UNI-ec7-1,"GERARD PUJADAS, Universitat Rovira i Virgili","The main goal of our project was the repositioning of accepted drugs as M-pro inhibitors. With this aim, we took from e-Drug3D (https://chemoinfo.ipmc.cnrs.fr/MOLDB/index.php) all the 1930 molecular structures approved between 1939 and 2019 by the FDA with a molecular weight ≤ 2000 Da and docked them at the binding site of 6LU7 structure by using three different docking programs (i.e., GlideSP, FRED and VINA). For each ligand and docking program, we have kept the top 10 docked poses (i.e., 10 for GlideSP, 10 for FRED and 10 for VINA). When considering 10 poses per ligand/program we assume that one of them will be the bioactive one (although the score function not always have ranked it as the first one). Finally the bioactive pose is assumed to be identified if it has been found simultaneously by the three programs (this means that the rmsd for each pairwise pose comparison is below 1.5 angstroms). Our idea here is that, in general, protein-ligand docking programs are really good when trying to look for the possible poses of a ligand in a binding site but usually fail to rank correctly such poses. Then, if three different protein-ligand programs find the same pose, this have a high probability to be the bioactive one.

Then, we applied a second filter in order to keep only those poses that are not only identified by the three programs but also show high affinity for M-pro. In order to find which threshold can be used to discriminate high from low affinity poses, we docked the 1577 compounds from the OTAVA Machine Learning SARS Targeted Library (https://otavachemicals.com/targets/sars-cov-2-targeted-libraries?utm_medium=email&utm_source=UniSender&utm_campaign=229613803) into the binding site of 6LU7 with GlideSP, FRED and VINA (with the identical set up conditions than were previously used for the 1930 FDA approved compounds). For this docking, we kept only the top-ranked pose obtained for each ligand by each programs. Then, we make three different histograms for the docking results of the OTAVA library (one per program) and arbitrarily selected as a threshold for distinguish from low to high M-pro affinity the lowest score value of the interval that contains the top 30% poses with the highest affinity. The resulting threshold was -6.3 for GlideSP, -7.0 for FRED and -7.5 for VINA. Then, all the poses that had succeed the first filter but had scores more positive than these threshold values were removed.

Then, only 5 FDA approved compounds simultaneously accomplished that: (1) the same pose is found independently by GlideSP, FRED and VINA; and (2) this pose has score values equal or more negative than the three mentioned thresholds.

This submission corresponds to one of these five compounds: CARPROFEN",x0072
CC(C(=O)O)c1ccc2c(c1)[nH]c1ccc(Cl)cc12,MAK-UNK-0d6-4,Maksym Voznyy,"by eye, inspired by GER-UNI-ec7-1",x0749
CC12CCC(CC1)C(C)(C)O2,BET-COM-8a5-1,"Bethany Lachele Foley, Complex Carbohydrate Research Center","I'm looking for common, inexpensive, widely available compounds, preferably volatile, that humans already safely inhale, and, if possible, enjoy inhaling, that might also be harmful to the virus.  I have quite a list of possibilities.

These two are components of lavender and eucalyptus.  They definitely fit into the binding site.  I haven't had time yet to do simulations to see if they stay in the binding site.  I'll work on that next.

Complete details of my work are here:  https://github.com/Lachele/SARS-CoV-2

I also plan to check all the other possible binding sites on the virion's surface.",x0072
CC12CCC(CC1)C(C)(C)O2,MAK-UNK-0cb-3,Maksym Voznyy,soap ingredients,x0749
CCNc1ccc(C#N)cc1CCNS(C)(=O)=O,ROB-UNI-b2e-1,"Robert Quinlan, University of Oxford","From fragalysis, observation of overlap of functionalities from the fragment hits.","x0072,x0104,x0305,x0748,x1249"
CCNc1ccc(C#N)cc1CCNS(C)(=O)=O,ANT-DIA-b7f-8,"Anthony Aimon, Diamond Light Source","work on non covalent fragments around cysteine 145. Idea is to interact with glutamine 189, met 165 and maybe go a bit deeper in the pocket.","x0072,x0305,x0387"
CCNc1ccc(F)c(Cc2cccc(NCC(=O)Nc3cccnc3)c2)n1,JOH-UNK-14e-5,Johannes Karges,The compounds were designed by conjugation of different fragments. The corresponding compounds were docked. The docking poses in pdb format are attached.,"x0104,x0305,x0434,x0692,x1386"
CCNc1ccc(F)c(Cc2cccc(NCC(=O)Nc3cccnc3)c2)n1,BEN-VAN-ed8-1,"Benjamin P. Brown, Vanderbilt University, Laboratory of Jens Meiler","###################
# CHEMICAL PROFILE
# Cluster 1
#
# Molecules designed by Benjamin P. Brown
# Graduate student in the laboratory of Jens Meiler, Ph.D.
# Email: benjamin.p.brown@vanderbilt.edu
# 
# Notes on the chemical profile:
#
# Design protocol: Fragments co-crystalized with COVID-19 main protease (released to the PDB by von Grelft group) served as starting
# scaffolds for redesign with an in-development Meiler Lab algorithm called BCL::FocusedLibraryDesign. The variation of this algorithm 
# utilized for this study incorporated a conventional supervised feed-forward deep neural network (DNN) as a pose-dependent protein-ligand 
# interface scorer. Fragments were perturbed in a Monte Carlo - Metropolis fashion using alchemical transformations, and refined at each step
# to minimize clashes, optimize pose orientation, and filter out unstable/non-drug-like modifications. The best optimizations by QSAR/QSPR analysis
# are recombined with BCL::LinkFragments, an in-development combinatorial chemistry algorithm. Again, molecules are optimized for clash resolution and
# interaction score. The best molecules undergo a final short run of BCL::FocusedLibraryDesign, and minor manual modifications are selectively made to
# intentionally increase probing of the structure-activity relationship (SAR). Finally, compounds are re-docked with RosettaLigand. The top-scoring complex
# is taken to be the final pose. Note that in multiple instances there is more than 1 well-populated binding pose. Here, we simply took the best scoring
# pose.
#
# Nomenclature: XLogP, XLogS, and XdG_Hyd are LogP, LogS, and dg_hydration (kcal/mol) predictions made using a multi-tasking deep neural network trained 
# in the BCL. LipinksiDruglike returns 1 if there are less than 2 Lipinksi violations. RS_Score_Raw and RSCONVOL_Score_Raw are two novel (in preparation)
# scoring functions developed in the BCL that use a DNN to prediction the binding affinity of small molecules to receptors (in units of -log(Kd)) using 
# either pose-dependent or pose-dependent+pose-independent protein-ligand hybrid descriptors. RS_AD and RSCONVOL_AD are applicability domain (AD) metrics
# of the DNN scores; values less_equal 0.90 are generally considered good and mean we trust the corresponding activity prediction reasonably well.
# RosettaLigandInterfaceScore is the interface_delta_X (protein-ligand interaction score) from Rosetta v3.11 of the best pose in Talaris2014 Rosetta energy
# units (REU). MoleculeComplexity is a metric by Ertl. et al., 2009, Journal of Cheminformatics, and generally less than 2.5 indicates the molecule is
# reasonably synthesizable.
#
##################","x0305,x0434"
CCNc1ncc(C#N)cc1CC(=O)Nc1cnccc1C,TRY-UNI-1fd-1,"Tryfon Zarganis - Tzitzikas, University of Oxford, TDI MedChem","The design of the molecules was done by superimposing the different fragments from the crystal structures (by eye). The reactions should be fairly easy urea formation or amide coupling all from readily available starting materials.

Fragments used for the conception of the ideas are the following
x0104, x0161, x0195, x0305, x0387, x0678, x1382","x0104,x0161,x0195,x0305,x0387,x0678,x1382"
CCNc1ncc(C#N)cc1CC(=O)Nc1cnccc1C,PET-SGC-175-1,"PETER BROWN, SGC, Univ Toronto",0107/0305 COMBO,"x0107,x0305"
CCNc1ncc(C#N)cc1CCNS(C)(=O)=O,PET-SGC-90a-1,"PETER BROWN, SGC, Univ Toronto",Combo of 0072 and 0305,"x0072,x0305"
CCNc1ncc(C#N)cc1CCNS(C)(=O)=O,BEN-DND-362-6,"Benjamin Perry, DNDi","By eye fragment merging approach; 3 discreet clusters of non-covalent binders identified in the active site. Each cluster had >n=2 examples of closeley related hits, giving confidence in the hit. Various designs made to merge the different fragments whilst retaining shape, binding location  and orientation","x0072,x0104,x0107,x0161,x0434,x0689,x0691"
CCNc1ncc(C#N)cc1CN1CCC(O)CC1,JAN-UNI-2e9-3,"Janine Gray, University of Oxford","Combinations of x195, 434, 305 387 which are in similar positions to try and expand into two pocket. Replacement of urea or sulphonamide with bioisosteres. Some look pretty heteroatom heaving but pyridine could be replaced by benzene.","x0195,x0305,x0387,x0434"
CCNc1ncc(C#N)cc1CN1CCC(O)CC1,PET-SGC-39d-2,"PETER BROWN, SGC, Univ Toronto",0305/0387 COMBOS,"x0305,x0387"
CCNc1ncc(C#N)cc1CN1CCN(C(=O)CCl)CC1,PAU-UNI-52c-1,"paul brear, University of Cambridge",Combination of covalent fragment x1418 and non covalent fragments x1249 and x0305,x1418
CCNc1ncc(C#N)cc1CN1CCN(C(=O)CCl)CC1,BRU-LEF-ae0-1,"Bruce a Lefker, Lefker Biopharmaconsulting LLC",Xtal structures of non-covalent Mpro-x0305 with covalent Mpro-x0770 show that the aryl rings of these two fragments are almost exactly overlapped.  Design is to therefore take the Mpro-x0770 structure and add the substituents found in Mpro-x0305 (switch the phenyl in x0770 to pyridyl to enable facile generation of the NEt,"x0305,x0770"
CCNc1ncc(C#N)cc1CN1CCN(C(=O)CCl)CC1,DAR-DIA-fb2-4,"Daren Fearon, Diamond Light Source Ltd",Merging of x0830 with x0305/x0104 and x0195 to target S1 pocket in addition to Cys145.,"x0104,x0195,x0305,x0830"
CCNc1ncc(C#N)cc1Cc1ccc2c(c1)C(=O)NC2,MAK-UNK-516-3,Maksym Voznyy,"by eye, inspired by GAB-REV-df6-19 (top active-covalent)",x0749
CCNc1ncc(C#N)cc1Cc1ccc2c(c1)C(=O)NC2,MAK-UNK-516-15,Maksym Voznyy,"by eye, inspired by GAB-REV-df6-19 (top active-covalent)",x0749
CCNc1ncc(C#N)cc1Cc1ccc2c(c1)C(=O)NC2,MAK-UNK-516-14,Maksym Voznyy,"by eye, inspired by GAB-REV-df6-19 (top active-covalent)",x0749
CCNc1ncc(C#N)cc1Cc1ccc2c(c1)C(=O)NC2,GAB-REV-df6-19,"Gabriel Grand, Reverie Labs, Inc.","Top 22 results hand-selected from a virtual fragment expansion, docking, and screening exercise. First, a set of 2.1K existing viral protease inhibitors from ChEMBL was analyzed to extract a library of 9.4K common design motifs. Reverie’s in-house fragment expansion engine was used to combinatorially place these fragments on the 3- and 4- positions of the 5-cyanopyridine of fragment X0305 via a variety of simple, synthetically-accessible linkers. Results were filtered extensively for toxicity and reactivity using an in-house library of SMARTS patterns, and an RDKit cLogP cutoff of 5.0 was applied. The remaining 19.4K compounds were docked via multiple docking methods and pose-constrained to match the orientation of the crystal-bound X0305 fragment. An ensemble of scoring functions was used to select a set of 479 compounds with high predicted affinity.
These compounds were manually triaged by individuals on the Reverie chemistry team to select the final set of compounds for submission. The final set includes compounds that make favorable hydrophobic interactions with Phe140, His163, Thr25, Thr45, Met145, His41, and Asn142.",x0305
CCNc1ncc(C#N)cc1Cc1ccc2c(c1)C(=O)NC2,MAK-UNK-516-12,Maksym Voznyy,"by eye, inspired by GAB-REV-df6-19 (top active-covalent)",x0749
CNS(=O)(=O)Cc1ccc2[nH]cc(CCN(C)C)c2c1,LON-WEI-b8d-34,"London Lab, Weizmann Institute of Science","Molecules made by Ugi reaction, designed by members of London Lab",x0072
CNS(=O)(=O)Cc1ccc2[nH]cc(CCN(C)C)c2c1,ANT-OPE-47f-1,"Anthony Sama, OpenSourceMycetoma",Sumatriptan is already approved in UK and US - has some similarity to fragment #104,x0104
CNS(=O)(=O)Cc1ccc2[nH]cc(CCN(C)C)c2c1,TOM-OIS-cbf-2,"Tomas Vojkovsky, OIST","Eletriptan (Relpax), naratrtriptan (Amerge) and sumatriptan (Imitrex) are a safe, approved anti-migraine medication, centrally active, eletriptan is dosed up to 80mg/day, naratriptan is dosed up to 5 mg/day and sumatriptan is dosed up to 100mg/single dose. They are widely available in tablet and in injection form.

They have a good overlap with noncovalently bound fragments in the Site 1, and seems to map particularly well on fragment hits X0072_0 and X0104_0, and few others. These approved drugs would not need to be synthesized, and if they show any signs of activity, could be prescribed off-label","x0072,x0104"
COc1cc2c(CCNC(C)=O)c[nH]c2cc1OS(=O)(=O)O,JOH-MSK-a63-2,"John Chodera, MSKCC",Melatonin metabolites with similar scaffold to Diamond hit x0104,x0104
COc1cc2c(CCNC(C)=O)c[nH]c2cc1OS(=O)(=O)O,WIL-LEE-364-13,"William McCorkindale, Lee Group, University of Cambridge","The candidates were generated using a genetic algorithm to optimise the geometric similarity between the molecules and the 3D alignment of the fragment hits. The initial population comprises all PostEra submissions as of March 22nd. The fitness of a member of the population is measured by assessing the similarity of its SOAP descriptor with that of the “target molecular field” (the SOAP descriptor generated using the PDB 3D co-ordinates of fragments at a particular binding site). We focus on sites 2 and 11, and the fitness function is the product of the similarities with target molecular fields for sites 2 and 11. The populations are evolved by performing mutating/breeding molecular graphs as described in https://doi.org/10.1039/C8SC05372C",x0072
COc1ccc2[nH]cc(CCNC(C)=O)c2c1,JOH-MSK-35a-1,"John Chodera, MSKCC","Melatonin, an endogenous molecule that has low peak concentrations in high-risk COVID-19 patients but high peak concentrations in low-risk COVID-19 patients",x0104
COc1ccc2[nH]cc(CCNC(C)=O)c2c1,ALE-ACE-261-1,"Alejandro Varela, Acellera Ltd.","A library of FDA approved compounds was screened for similarity against the provided fragments. We found that melatonin has a high similarity with fragment x0104. 

An in silico binding assay was run with HTMD and ACEMD3 using the adaptiveGoal  protocol to simulate the binding of melatonin to the target protein.

We were able to see the binding event and the binding mode resembles that of x0104.",x0104
CS(=O)(=O)NCC(C(=O)Nc1cccnc1)c1ccccc1,DRE-WAB-ae4-1,"Drew Stanton, Wabash College","I chose to represent my 9b7 structure in this structure (more than my eb7) structure because I got better results from that structure (when using computational docking).  However, changing the Nitrogen to a Carbon (where the Sulfer chain is attached) and changing the one of the Carbons in the phenyl ring into a Nitrogen seemed like it would improve my inhibitor because this allows the structure of it to match closer to the two fragments that I used to build this inhibitor.","x0072,x0434"
CS(=O)(=O)NCC(C(=O)Nc1cccnc1)c1ccccc1,PET-SGC-d01-1,"PETER BROWN, SGC, Univ Toronto",Combos of 0072 and 0678,"x0072,x0678"
CS(=O)(=O)NCC(C(=O)Nc1cccnc1)c1ccccc1,PET-SGC-b0f-1,"PETER BROWN, SGC, Univ Toronto",Combo of 0072 and 0434,"x0072,x0434"
Cc1ccncc1NC(=O)CC(CNS(C)(=O)=O)c1ccccc1,PET-SGC-d5b-1,"PETER BROWN, SGC, Univ Toronto",Combo of frags 0072 and 0107,"x0072,x0107"
Cc1ccncc1NC(=O)CC(CNS(C)(=O)=O)c1ccccc1,WIL-WAB-6ef-1,"Willard Haunfelder`, Wabash College",This design is a combination of fragments 0072 and 0107 by combining them with a bond between C1 on 0072 to C7 on 0107,"x0072,x0107"
Cc1ccncc1NC(=O)CC1CCCCC1,TRY-UNI-714-10,"Tryfon Zarganis - Tzitzikas, University of Oxford, TDI MedChem","The design of the molecules was done by superimposing the different fragments from the crystal structures (by eye). The reactions should be fairly easy urea formation or amide coupling all from readily available starting materials.
Fragments used for the conception of the ideas are the following
x0107, x0434, x0678, x0748, x0995, x1382","x0107,x0434,x0678,x0748,x0995,x1382"
